{
  "schemaVersion": 2,
  "fixture": "spec/conformance/sqlite-cursor-pre-rebind-v1.case.json",
  "auditPolicy": "EXACT requires exclusive canonical executionIds emitted by a real passing runner. Every ID must be owned by one case only; Vitest fullName and pytest nodeid matching is byte-exact with no wildcard, prefix, normalization, title-source, or fallback matching.",
  "generatedAt": "2026-07-28",
  "cases": [
    {
      "group": "pristine",
      "caseId": "empty",
      "typescript": {
        "status": "EXACT",
        "file": "packages/sqlite/test/cursor-pre-rebind-contract.test.ts",
        "title": "recomputes all five literal semantic vectors through inspector and A1 [empty]",
      "asserts": "fixture-contract declares zero source rows and zero ten-vector; production seal accumulator finishes cursorCount=0 with the exact fixture A1 root",
        "executionIds": [
          "packages/sqlite/test/cursor-pre-rebind-contract.test.ts::SQLite cursor pre-rebind generated contract recomputes literal semantic vector empty [b2:empty]"
        ]
      },
      "python": {
        "status": "EXACT",
        "file": "python/tests/test_sqlite_operation_baseline_cursor_inspection.py",
        "title": "test_shared_semantic_vectors_recompute_exact_a1_roots[empty]",
      "asserts": "fixture-contract declares zero source rows; production seal accumulator finishes cursorCount=0 with the exact fixture A1 root",
        "executionIds": [
          "python/tests/test_sqlite_operation_baseline_cursor_inspection.py::test_shared_semantic_vectors_recompute_exact_a1_roots[b2:empty]"
        ]
      }
    },
    {
      "group": "pristine",
      "caseId": "event-empty-tail",
      "typescript": {
        "status": "EXACT",
        "file": "packages/sqlite/test/cursor-pre-rebind-contract.test.ts",
        "title": "recomputes all five literal semantic vectors through inspector and A1 [event-empty]",
      "asserts": "fixture-contract eventEmpty row is passed through the production inspector; its nine row flags are true; the production seal accumulator reproduces the exact fixture A1 root and the fixture declares a zero ten-vector",
        "executionIds": [
          "packages/sqlite/test/cursor-pre-rebind-contract.test.ts::SQLite cursor pre-rebind generated contract recomputes literal semantic vector event-empty [b2:event-empty-tail]"
        ]
      },
      "python": {
        "status": "EXACT",
        "file": "python/tests/test_sqlite_operation_baseline_cursor_inspection.py",
        "title": "test_shared_semantic_vectors_recompute_exact_a1_roots[event-empty]",
      "asserts": "fixture-contract eventEmpty row is passed through the production inspector; stageable/insert shapes and all nine row flags are checked; the production seal accumulator reproduces the exact fixture A1 root",
        "executionIds": [
          "python/tests/test_sqlite_operation_baseline_cursor_inspection.py::test_shared_semantic_vectors_recompute_exact_a1_roots[b2:event-empty-tail]"
        ]
      }
    },
    {
      "group": "pristine",
      "caseId": "event-nonempty-tail",
      "typescript": {
        "status": "EXACT",
        "file": "packages/sqlite/test/cursor-pre-rebind-contract.test.ts",
        "title": "recomputes all five literal semantic vectors through inspector and A1 [event-nonempty]",
      "asserts": "fixture-contract retained event tail row is passed through the production inspector with fixture history lookup; nine row flags are true and the production seal accumulator reproduces the exact fixture A1 root",
        "executionIds": [
          "packages/sqlite/test/cursor-pre-rebind-contract.test.ts::SQLite cursor pre-rebind generated contract recomputes literal semantic vector event-nonempty [b2:event-nonempty-tail]"
        ]
      },
      "python": {
        "status": "EXACT",
        "file": "python/tests/test_sqlite_operation_baseline_cursor_inspection.py",
        "title": "test_shared_semantic_vectors_recompute_exact_a1_roots[event-nonempty]",
      "asserts": "fixture-contract retained event tail row is passed through the production inspector with fixture history lookup; all nine row flags and the exact fixture A1 root are checked",
        "executionIds": [
          "python/tests/test_sqlite_operation_baseline_cursor_inspection.py::test_shared_semantic_vectors_recompute_exact_a1_roots[b2:event-nonempty-tail]"
        ]
      }
    },
    {
      "group": "pristine",
      "caseId": "checkpoint-historical-put",
      "typescript": {
        "status": "EXACT",
        "file": "packages/sqlite/test/cursor-pre-rebind-contract.test.ts",
        "title": "recomputes all five literal semantic vectors through inspector and A1 [checkpoint]",
      "asserts": "fixture-contract historical checkpoint put row is passed through the production inspector with exact summary bytes; nine row flags are true and the production seal accumulator reproduces the exact fixture A1 root",
        "executionIds": [
          "packages/sqlite/test/cursor-pre-rebind-contract.test.ts::SQLite cursor pre-rebind generated contract recomputes literal semantic vector checkpoint [b2:checkpoint-historical-put]"
        ]
      },
      "python": {
        "status": "EXACT",
        "file": "python/tests/test_sqlite_operation_baseline_cursor_inspection.py",
        "title": "test_shared_semantic_vectors_recompute_exact_a1_roots[checkpoint]",
      "asserts": "fixture-contract historical checkpoint put row is passed through the production inspector with exact summary bytes; all nine row flags and the exact fixture A1 root are checked",
        "executionIds": [
          "python/tests/test_sqlite_operation_baseline_cursor_inspection.py::test_shared_semantic_vectors_recompute_exact_a1_roots[b2:checkpoint-historical-put]"
        ]
      }
    },
    {
      "group": "pristine",
      "caseId": "event-checkpoint-cross-order",
      "typescript": {
        "status": "EXACT",
        "file": "packages/sqlite/test/cursor-pre-rebind-contract.test.ts",
        "title": "recomputes all five literal semantic vectors through inspector and A1 [cross-order]",
      "asserts": "fixture-contract checkpoint/event rows are passed through the production inspector then reduced in token/tenant order; all nine row flags per row and the exact fixture A1 root are checked",
        "executionIds": [
          "packages/sqlite/test/cursor-pre-rebind-contract.test.ts::SQLite cursor pre-rebind generated contract recomputes literal semantic vector cross-order [b2:event-checkpoint-cross-order]"
        ]
      },
      "python": {
        "status": "EXACT",
        "file": "python/tests/test_sqlite_operation_baseline_cursor_inspection.py",
        "title": "test_shared_semantic_vectors_recompute_exact_a1_roots[cross-order]",
      "asserts": "fixture-contract cross-order rows are passed through the production inspector then reduced in token/tenant order; all nine row flags per row and the exact fixture A1 root are checked",
        "executionIds": [
          "python/tests/test_sqlite_operation_baseline_cursor_inspection.py::test_shared_semantic_vectors_recompute_exact_a1_roots[b2:event-checkpoint-cross-order]"
        ]
      }
    },
    {
      "group": "pristine",
      "caseId": "same-token-two-tenants",
      "typescript": {
        "status": "EXACT",
        "file": "packages/sqlite/test/operation-baseline-cursor-stage-ownership.test.ts",
        "title": "accepts the same token hash for two tenants through the composite TEMP key",
        "asserts": "real DB campaign completes; TEMP order contains both tenant identities",
        "executionIds": [
          "packages/sqlite/test/operation-baseline-cursor-stage-ownership.test.ts::SQLite Cursor Slice B2 pre-rebind campaign accepts the same token hash for two tenants through the composite TEMP key [b2:same-token-two-tenants]"
        ]
      },
      "python": {
        "status": "EXACT",
        "file": "python/tests/test_sqlite_operation_baseline_cursor_campaign.py",
        "title": "test_pristine_consumed_expired_page_and_composite_key_boundaries_complete[same-token]",
        "asserts": "campaign completes; exact same-token tenant-1/tenant-2 rows and terminal EOF",
        "executionIds": [
          "python/tests/test_sqlite_operation_baseline_cursor_campaign.py::test_pristine_consumed_expired_page_and_composite_key_boundaries_complete[b2:same-token-two-tenants]"
        ]
      }
    },
    {
      "group": "pristine",
      "caseId": "page-size-one",
      "typescript": {
        "status": "EXACT",
        "file": "packages/sqlite/test/operation-baseline-cursor-stage-ownership.test.ts",
        "title": "accepts consumed, expired-at-capture, and page-size boundary cursors",
        "asserts": "real campaign includes page size 1 and completes with zero vector",
        "executionIds": [
          "packages/sqlite/test/operation-baseline-cursor-stage-ownership.test.ts::SQLite Cursor Slice B2 pre-rebind campaign accepts pristine boundary page-size-one [b2:page-size-one]"
        ]
      },
      "python": {
        "status": "EXACT",
        "file": "python/tests/test_sqlite_operation_baseline_cursor_campaign.py",
      "title": "test_pristine_consumed_expired_page_and_composite_key_boundaries_complete[page-size-one]",
      "asserts": "isolated real row is asserted as page_size=1, created=500, expires=1500, unconsumed; production campaign completes with the exact zero vector",
        "executionIds": [
          "python/tests/test_sqlite_operation_baseline_cursor_campaign.py::test_pristine_consumed_expired_page_and_composite_key_boundaries_complete[b2:page-size-one]"
        ]
      }
    },
    {
      "group": "pristine",
      "caseId": "page-size-256",
      "typescript": {
        "status": "EXACT",
        "file": "packages/sqlite/test/operation-baseline-cursor-stage-ownership.test.ts",
        "title": "accepts consumed, expired-at-capture, and page-size boundary cursors",